{
  "schema_version": "0.3",
  "scan": {
    "timestamp": "2026-05-24T12:00:00-07:00",
    "model": "claude-opus-4-7",
    "prompt_version": "0.1",
    "duration_seconds": 42.1
  },
  "project": {
    "name": "test-fixture",
    "files_scanned": 3,
    "size_budget_status": "within",
    "commit_hash": "abc1234",
    "branch": "main",
    "stack_packs_loaded": []
  },
  "data_profile": {
    "sensitivity_tier": "standard",
    "categories": [
      {
        "category": "auth_credentials",
        "confidence": "high",
        "evidence_summary": "password field in User model"
      }
    ],
    "regulatory_flags": [
      {
        "regulation": "GDPR",
        "applicability": "possibly",
        "rationale": "Handles user identity data; jurisdiction unknown from source."
      }
    ],
    "context_note": "Standard-tier app handling user auth. Findings should be reviewed in light of user data exposure risk."
  },
  "threat_model": {
    "dfd": {
      "mermaid": "flowchart LR\n  subgraph internet[\"Public Internet\"]\n    user([\"User\"])\n  end\n  subgraph app[\"Application\"]\n    api[\"API Server\"]\n  end\n  subgraph data[\"Data Tier\"]\n    db[(\"Database\")]\n  end\n  user -->|\"HTTPS\"| api\n  api -->|\"SQL\"| db",
      "notes": "Minimal fixture diagram for testing."
    }
  },
  "summary": {
    "scorecard": {
      "code": "F",
      "dependencies": "N/A",
      "secrets_and_config": "A",
      "architecture": "A",
      "overall": "F"
    },
    "counts_by_severity": {
      "critical": 1,
      "high": 0,
      "medium": 0,
      "low": 0,
      "info": 0
    },
    "counts_by_confidence": {
      "high": 1,
      "medium": 0,
      "low": 0
    }
  },
  "findings": [
    {
      "id": "8104ca4b",
      "category": "CODE_injection",
      "severity": "critical",
      "confidence": "high",
      "title": "SQL injection via unsanitised user_id parameter in /users/<id> route",
      "evidence": {
        "file": "app/routes/users.py",
        "line_start": 14,
        "line_end": 14,
        "quote": "query = f\"SELECT * FROM users WHERE id = {user_id}\""
      },
      "exploitation_path": "Attacker passes `1 OR 1=1` as user_id to dump the full users table.",
      "remediation": "Use a parameterised query: `cursor.execute('SELECT * FROM users WHERE id = %s', (user_id,))`",
      "owasp_mapping": ["A03"],
      "dfd_element": "api",
      "references": ["CWE-89"]
    }
  ],
  "notes": []
}
